{
  "request_id": "fixture-warning-prepare",
  "capability_id": "assist.personal-decision.v1",
  "user_id": "owner-local",
  "created_at": "2026-07-12T17:10:00+07:00",
  "goal": "Determine a personal posture for a synthetic flood forecast",
  "question": "Should I prepare, wait, or take protective action?",
  "selected_content": "Synthetic exercise: possible flooding within 48 hours.",
  "content_source": {"type": "synthetic_fixture", "origin_verified": true},
  "data_class": "personal",
  "declared_domain": "emergency",
  "memory_permission": "session",
  "remote_permission": "deny",
  "output_preference": "warning_card",
  "synthetic": true,
  "user_priorities": ["life safety", "minimal false alarm"],
  "warning": {
    "event_id": "synthetic-flood-001",
    "hazard_type": "flood",
    "official_status": "none_found",
    "issuer": "synthetic training source",
    "authority_authenticated": false,
    "message_status": "Actual",
    "message_type": "Alert",
    "issued_at": "2026-07-12T17:00:00+07:00",
    "expires_at": "2026-07-14T17:00:00+07:00",
    "affected_area": "synthetic area near configured user region",
    "area_match": "near",
    "urgency": "Future",
    "severity": "Moderate",
    "certainty": "Possible",
    "instruction": "Monitor responsible authorities and review household preparedness.",
    "evidence_tier": "V2",
    "integrity_status": "pass",
    "source_conflict": false,
    "stale": false,
    "direct_danger": false
  }
}
