{
  "request_id": "fixture-warning-urgent",
  "capability_id": "assist.personal-decision.v1",
  "user_id": "owner-local",
  "created_at": "2026-07-12T17:15:00+07:00",
  "goal": "Determine a personal posture for a synthetic immediate alert",
  "question": "What is the immediate safe posture?",
  "selected_content": "Synthetic authenticated alert instructs the affected area to move to higher ground.",
  "content_source": {"type": "synthetic_fixture", "origin_verified": true},
  "data_class": "personal",
  "declared_domain": "emergency",
  "memory_permission": "session",
  "remote_permission": "deny",
  "output_preference": "warning_card",
  "synthetic": true,
  "user_priorities": ["life safety", "official instruction"],
  "warning": {
    "event_id": "synthetic-flood-urgent-001",
    "hazard_type": "flash flood",
    "official_status": "active",
    "issuer": "synthetic registered authority",
    "official_url": "https://example.invalid/synthetic-alert",
    "authority_authenticated": true,
    "message_status": "Actual",
    "message_type": "Alert",
    "issued_at": "2026-07-12T17:14:00+07:00",
    "expires_at": "2026-07-12T19:14:00+07:00",
    "affected_area": "synthetic configured area",
    "area_match": "inside",
    "urgency": "Immediate",
    "severity": "Severe",
    "certainty": "Likely",
    "instruction": "Synthetic exercise only: move to higher ground now.",
    "evidence_tier": "V3",
    "integrity_status": "pass",
    "source_conflict": false,
    "stale": false,
    "direct_danger": false
  }
}
